{
  "$schema": "https://json-schema.org/draft/2020-12/schema",
  "title": "plans/<id>.json",
  "description": "One retirement scenario (PLANNER.md). Amounts are yearly, in today's money (real terms), in the library's base currency, and after income tax: income from work and pensions is entered net, and the plan computes only the taxes of tax. Only id, name, retirement and spending are required; a section left out takes its defaults, and the app leaves out sections and lists that are empty.",
  "type": "object",
  "required": ["id", "name", "retirement", "spending"],
  "properties": {
    "id": {
      "description": "The same as the file name, and the name of the plan's projections/<id>/ folder.",
      "$ref": "common.schema.json#/$defs/slug"
    },
    "name": { "type": "string" },
    "retirement": {
      "type": "object",
      "required": ["age"],
      "properties": {
        "age": {
          "description": "The age work stops: retiring at an age means stopping work on that birthday, or on the start date if it has passed. \"earliest\" lets the planner find the earliest age that reaches the confidence level. At most endAge (error planner.retirementAge).",
          "anyOf": [{ "$ref": "common.schema.json#/$defs/age" }, { "const": "earliest" }]
        }
      }
    },
    "endAge": {
      "description": "The last age the plan must fund. Default 95; above your age and at most 120 (error planner.endAge).",
      "type": "integer",
      "maximum": 120
    },
    "tax": {
      "description": "The only taxes the plan computes, set by hand.",
      "type": "object",
      "properties": {
        "investmentRate": {
          "description": "The tax on investments, as a fraction (\"0.26\"): on the gain part of every sale from the money you can draw, and every year on the income its classes pay out (assumptions.returns.<class>.incomeYield), paid the following year. Without it the plan assumes 0%, with a warning (planner.noInvestmentRate); \"0\" when investments aren't taxed. From 0 to 0.9.",
          "$ref": "common.schema.json#/$defs/decimal"
        },
        "wealthRate": {
          "description": "A yearly tax on the money you can draw above wealthAllowance, as a fraction (\"0.002\"). Accounts available only from a later age aren't counted until they open. Default 0; from 0 to 0.1 (error planner.wealthRate).",
          "$ref": "common.schema.json#/$defs/decimal"
        },
        "wealthAllowance": {
          "description": "What the wealth tax leaves untaxed. Default 0; not negative (error planner.wealthAllowance).",
          "$ref": "common.schema.json#/$defs/decimal"
        }
      }
    },
    "work": {
      "description": "Working phases. Every phase stops at retirement, whatever its until. Phases don't overlap: one that starts while another still runs is an error (planner.workOverlap).",
      "type": "array",
      "items": { "$ref": "#/$defs/workPhase" }
    },
    "spending": { "$ref": "#/$defs/spending" },
    "pensions": { "type": "array", "items": { "$ref": "#/$defs/pension" } },
    "income": {
      "description": "Other income, such as rent, a side business or part-time work once retired. Unlike work, it doesn't stop at retirement.",
      "type": "array",
      "items": { "$ref": "#/$defs/income" }
    },
    "contributions": {
      "description": "Payments into specific accounts, such as a pension fund. They come out of the year's savings; the rest goes to the money you can draw.",
      "type": "array",
      "items": { "$ref": "#/$defs/contribution" }
    },
    "events": {
      "description": "One-off amounts. At most 64 can be uncertain (error planner.uncertainEvents).",
      "type": "array",
      "items": { "$ref": "#/$defs/event" }
    },
    "portfolio": { "$ref": "#/$defs/portfolio" },
    "assumptions": { "$ref": "#/$defs/assumptions" },
    "simulation": {
      "type": "object",
      "properties": {
        "runs": {
          "description": "The number of Monte Carlo runs. Default 2000; from 1 to 10000 (error planner.runs).",
          "type": "integer",
          "minimum": 1,
          "maximum": 10000
        },
        "seed": {
          "description": "The random seed; every run of the plan uses the same draws, so differences come from your changes. Default 1.",
          "type": "integer",
          "minimum": 0
        },
        "confidence": {
          "description": "The share of simulated futures that must succeed for a \"yes\". Default \"0.9\"; above 0 and below 1 (error planner.confidence).",
          "$ref": "common.schema.json#/$defs/decimal"
        }
      }
    }
  },
  "$defs": {
    "phaseEnd": {
      "description": "A date, or \"retirement\", which follows the retirement age.",
      "anyOf": [{ "$ref": "common.schema.json#/$defs/date" }, { "const": "retirement" }]
    },
    "workPhase": {
      "type": "object",
      "required": ["from", "until"],
      "properties": {
        "name": { "description": "Default \"Work\", or \"Work 2\" when there are several.", "type": "string" },
        "from": { "description": "The phase's first day.", "$ref": "common.schema.json#/$defs/date" },
        "until": {
          "description": "The phase's last day, or retirement. Not before from (error planner.workDates).",
          "$ref": "#/$defs/phaseEnd"
        },
        "netIncome": {
          "description": "What reaches your account in a year, after income tax and social contributions. Required for the plan to run (error planner.noNetIncome); plans migrated from a gross amount lack it until it's entered.",
          "$ref": "common.schema.json#/$defs/decimal"
        },
        "realGrowth": {
          "description": "Yearly growth of the income above inflation, as a fraction. Default 0.",
          "$ref": "common.schema.json#/$defs/decimal"
        }
      }
    },
    "spending": {
      "description": "Yearly spending. Savings are what's left of income after spending.",
      "type": "object",
      "required": ["working", "retired"],
      "properties": {
        "working": { "description": "While working.", "$ref": "common.schema.json#/$defs/decimal" },
        "retired": { "description": "In retirement, before phase factors.", "$ref": "common.schema.json#/$defs/decimal" },
        "phases": {
          "description": "Factors on retirement spending from given ages: the latest phase started is in force, 1 before the first. Each phase has its own fromAge (error planner.spendingPhaseAges).",
          "type": "array",
          "items": {
            "type": "object",
            "required": ["fromAge", "factor"],
            "properties": {
              "fromAge": { "$ref": "common.schema.json#/$defs/age" },
              "factor": {
                "description": "E.g. \"0.9\" for 90% of retirement spending.",
                "$ref": "common.schema.json#/$defs/decimal"
              }
            }
          }
        },
        "flexible": { "$ref": "#/$defs/flexibleSpending" }
      }
    },
    "flexibleSpending": {
      "description": "A guardrails rule that cuts retirement spending after bad years and restores it after good ones, never below a floor (PLANNER.md, Flexible spending). Absent: retirement spending is fixed in real terms. { \"enabled\": true } is the rule with the defaults. Every share is a fraction of the plan's spending; what's left out takes the default. Out-of-range settings are an error while the rule is on (planner.flexibleSpending).",
      "type": "object",
      "properties": {
        "enabled": {
          "description": "false turns the rule off and keeps its settings in the file. Default true.",
          "type": "boolean"
        },
        "cut": {
          "description": "How much a cut, or a raise, moves the spending level. Default \"0.1\"; above 0, at most 1.",
          "$ref": "common.schema.json#/$defs/decimal"
        },
        "floor": {
          "description": "The lowest the level goes: the essentials. A run succeeds while spending is never forced below it. Default \"0.8\"; from 0 to 1.",
          "$ref": "common.schema.json#/$defs/decimal"
        },
        "upperGuardrail": {
          "description": "How far the withdrawal rate may rise above the first retirement year's, as a share of it, before spending is cut. Default \"0.2\".",
          "$ref": "common.schema.json#/$defs/decimal"
        },
        "lowerGuardrail": {
          "description": "How far it must fall below the first year's, as a share of it, before a cut is restored. Default \"0.2\".",
          "$ref": "common.schema.json#/$defs/decimal"
        }
      }
    },
    "pension": {
      "description": "A pension from your pension statement, after tax, kept in real terms. Paid from the birthday at fromAge (part of a year in the year it starts); one starting after endAge is never paid (warning planner.pensionAfterEnd).",
      "type": "object",
      "properties": {
        "name": { "type": "string" },
        "fromAge": {
          "description": "The age it starts at. Required for the plan to run (error planner.pensionAmount).",
          "$ref": "common.schema.json#/$defs/age"
        },
        "perYear": {
          "description": "The yearly amount after tax. Required for the plan to run (error planner.pensionAmount).",
          "$ref": "common.schema.json#/$defs/decimal"
        }
      }
    },
    "income": {
      "description": "Income besides work and pensions, after tax, kept in real terms. Paid from the birthday at from, or from retirement, to the day before the birthday at untilAge (part of a year where it starts and stops); one starting after endAge is never paid (warning planner.otherIncomeAfterEnd).",
      "type": "object",
      "properties": {
        "name": { "type": "string" },
        "from": {
          "description": "The age it starts at, or retirement: the day work stops, whatever the retirement age turns out to be. Required for the plan to run (error planner.otherIncomeAmount).",
          "anyOf": [{ "$ref": "common.schema.json#/$defs/age" }, { "const": "retirement" }]
        },
        "untilAge": {
          "description": "The age it stops at. Absent: to the plan's end. After a from age (error planner.otherIncomeAges).",
          "$ref": "common.schema.json#/$defs/age"
        },
        "perYear": {
          "description": "The yearly amount after tax. Required for the plan to run (error planner.otherIncomeAmount).",
          "$ref": "common.schema.json#/$defs/decimal"
        }
      }
    },
    "contribution": {
      "description": "Every year while working (perYear, until until), or once (amount in year). One into an account the plan doesn't count is left out (warning planner.contributionOutsidePlan). Not negative.",
      "type": "object",
      "required": ["account"],
      "anyOf": [{ "required": ["perYear"] }, { "required": ["amount"] }],
      "properties": {
        "account": { "$ref": "common.schema.json#/$defs/slug" },
        "perYear": {
          "description": "The yearly amount. Left out for a one-off amount.",
          "$ref": "common.schema.json#/$defs/decimal"
        },
        "until": { "description": "When yearly contributions stop. Default retirement.", "$ref": "#/$defs/phaseEnd" },
        "amount": {
          "description": "A one-off amount, paid in year, instead of perYear.",
          "$ref": "common.schema.json#/$defs/decimal"
        },
        "year": { "description": "The calendar year of a one-off amount. Default: the plan's first year.", "type": "integer" }
      }
    },
    "event": {
      "description": "A one-off amount, at an age or in a year (exactly one of the two).",
      "type": "object",
      "required": ["name", "amount"],
      "oneOf": [{ "required": ["age"] }, { "required": ["year"] }],
      "properties": {
        "name": { "type": "string" },
        "age": { "$ref": "common.schema.json#/$defs/age" },
        "year": { "type": "integer" },
        "amount": {
          "description": "Positive for a windfall, negative for an expense; after any tax on it.",
          "$ref": "common.schema.json#/$defs/decimal"
        },
        "probability": {
          "description": "The chance it happens, default \"1\". Each Monte Carlo run draws whether it does; the deterministic run includes it from 0.5.",
          "$ref": "common.schema.json#/$defs/decimal"
        }
      }
    },
    "portfolio": {
      "description": "Where the plan starts and the mix it rebalances to.",
      "type": "object",
      "properties": {
        "start": {
          "description": "The check-in the plan starts from: \"latest-check-in\" (the default) or a date.",
          "anyOf": [{ "const": "latest-check-in" }, { "$ref": "common.schema.json#/$defs/date" }]
        },
        "exclude": {
          "description": "Accounts left out, besides those with includeIn.plan false and closed ones.",
          "type": "array",
          "items": { "$ref": "common.schema.json#/$defs/slug" }
        },
        "unrealizedGainShare": {
          "description": "The estimated share of value that's gain, for holdings without a recorded costBasis. Without it their whole value counts as gain (warning planner.unknownCostBasis).",
          "$ref": "common.schema.json#/$defs/decimal"
        },
        "targetMix": {
          "description": "The mix the money you can draw is rebalanced to every year, from today. Left out: it's rebalanced back to its own mix at the start. A mix that doesn't add up to 1 is scaled (warning planner.targetMixTotal).",
          "$ref": "common.schema.json#/$defs/assetMix"
        },
        "targetMixByAge": {
          "description": "Changes of the target mix with age. Each year's target is the mix of the last step in the list that has started by the age reached that year; before any has, targetMix. Ages given as numbers must go up (error planner.targetMixAges); a retirement step can be anywhere.",
          "type": "array",
          "items": {
            "type": "object",
            "required": ["fromAge", "mix"],
            "properties": {
              "fromAge": {
                "description": "An age, or \"retirement\": the year work stops, for whatever retirement age the planner tries.",
                "anyOf": [{ "$ref": "common.schema.json#/$defs/age" }, { "const": "retirement" }]
              },
              "mix": { "$ref": "common.schema.json#/$defs/assetMix" }
            }
          }
        }
      }
    },
    "assumptions": {
      "type": "object",
      "properties": {
        "inflation": {
          "description": "Yearly inflation, as a fraction. It only matters for taxes: what you paid stays in the money of the day, so inflation counts as gain when sold. Default \"0.02\"; from -0.5 to 0.5 (error planner.inflation).",
          "$ref": "common.schema.json#/$defs/decimal"
        },
        "returns": {
          "description": "Each asset class's yearly real return, net of fund costs. A class left out takes the default: by their median, equity 5% at 17% volatility, bonds 1.5% at 6%, cash 0.5% at 1%, gold 1% at 15%, crypto 0% at 70% (PLANNER.md, Returns).",
          "type": "object",
          "propertyNames": { "$ref": "common.schema.json#/$defs/assetClass" },
          "additionalProperties": { "$ref": "#/$defs/returnAssumption" }
        },
        "correlations": {
          "description": "Correlations between classes' returns, as nested objects: { \"equity\": { \"bonds\": \"0.1\", \"crypto\": \"0.4\" } }. One direction is enough. A pair left out takes its default: equity–bonds 0.1, equity–crypto 0.4, other pairs 0. A table that isn't positive definite is repaired (warning planner.correlationsRepaired).",
          "type": "object",
          "propertyNames": { "$ref": "common.schema.json#/$defs/assetClass" },
          "additionalProperties": {
            "type": "object",
            "propertyNames": { "$ref": "common.schema.json#/$defs/assetClass" },
            "additionalProperties": { "$ref": "common.schema.json#/$defs/decimal" }
          }
        }
      }
    },
    "returnAssumption": {
      "description": "A log-normal yearly real return, given by its mean (real) or its median (medianReal), not both, with its volatility. With gross mean A, gross median g and volatility σ, g = A² / √(A² + σ²).",
      "type": "object",
      "required": ["volatility"],
      "oneOf": [{ "required": ["real"] }, { "required": ["medianReal"] }],
      "properties": {
        "real": { "description": "The arithmetic mean, as a fraction.", "$ref": "common.schema.json#/$defs/decimal" },
        "medianReal": {
          "description": "The median, the typical year, which a portfolio rebalanced every year compounds at.",
          "$ref": "common.schema.json#/$defs/decimal"
        },
        "volatility": { "description": "The standard deviation of yearly returns.", "$ref": "common.schema.json#/$defs/decimal" },
        "incomeYield": {
          "description": "The share of the value paid out as income each year (dividends, interest): part of the return, not extra, and taxed every year at tax.investmentRate. Left out: income counts as growth, taxed when sold.",
          "$ref": "common.schema.json#/$defs/decimal"
        }
      }
    }
  }
}
