{
  "events": [
    { "amount": "-15000", "name": "Sabbatical", "year": 2033 }
  ],
  "id": "part-time-from-50",
  "name": "Part-time from 50",
  "pensions": [
    { "fromAge": 67, "name": "State pension", "perYear": "11000" },
    { "fromAge": 67, "name": "Pension from previous country", "perYear": "4800" }
  ],
  "portfolio": {
    "exclude": ["gold-coins"],
    "start": "2026-06-30",
    "targetMix": { "bonds": "0.2", "equity": "0.8" },
    "targetMixByAge": [
      { "fromAge": "retirement", "mix": { "bonds": "0.4", "equity": "0.6" } },
      { "fromAge": 75, "mix": { "bonds": "0.6", "equity": "0.4" } }
    ]
  },
  "retirement": { "age": "earliest" },
  "simulation": { "runs": 500 },
  "spending": { "flexible": { "enabled": false, "floor": "0.85" }, "retired": "32000", "working": "34000" },
  "tax": { "investmentRate": "0.26" },
  "work": [
    { "from": "2026-01-01", "netIncome": "40000", "realGrowth": "0.01", "until": "2038-04-11" },
    { "from": "2038-04-12", "name": "Part-time", "netIncome": "18000", "until": "retirement" }
  ]
}
