{
  "assumptions": {
    "correlations": { "equity": { "bonds": "0.1", "crypto": "0.4", "gold": "0.05" } },
    "inflation": "0.02",
    "returns": {
      "bonds": { "real": "0.01", "volatility": "0.06" },
      "cash": { "real": "0", "volatility": "0.01" },
      "crypto": { "medianReal": "0", "volatility": "0.7" },
      "equity": { "real": "0.045", "volatility": "0.17" },
      "gold": { "real": "0.01", "volatility": "0.15" }
    }
  },
  "contributions": [
    { "account": "fondo-pensione", "perYear": "5000", "until": "retirement" }
  ],
  "endAge": 95,
  "events": [
    { "age": 62, "amount": "150000", "name": "Inheritance", "probability": "0.8" },
    { "amount": "-25000", "name": "New car", "year": 2031 }
  ],
  "id": "base",
  "name": "Base case",
  "pensions": [
    { "fromAge": 67, "name": "State pension", "perYear": "14000" },
    { "fromAge": 67, "name": "State pension from previous country", "perYear": "4800" }
  ],
  "portfolio": { "start": "latest-check-in", "unrealizedGainShare": "0.2" },
  "retirement": { "age": 55 },
  "simulation": { "confidence": "0.9", "runs": 2000, "seed": 1 },
  "spending": {
    "phases": [{ "factor": "0.9", "fromAge": 75 }, { "factor": "0.8", "fromAge": 85 }],
    "retired": "36000",
    "working": "36000"
  },
  "tax": { "investmentRate": "0.26", "wealthAllowance": "5000", "wealthRate": "0.002" },
  "work": [
    { "from": "2026-01-01", "name": "Employee", "netIncome": "40000", "realGrowth": "0.01", "until": "2028-12-31" },
    { "from": "2029-01-01", "name": "Self-employed", "netIncome": "48000", "until": "retirement" }
  ]
}
